{
  "$schema": "../theme.schema.json",
  "name": "graphite",
  "label": "Graphite",
  "description": "Muted steel accent and deeper neutral tint for dense product UI.",
  "shared": {
    "radius-selector": "4px",
    "radius-field": "6px",
    "radius-box": "8px",
    "border-width": "1px",
    "depth": "1",
    "font-sans": "IBM Plex Sans, Segoe UI, system-ui, sans-serif",
    "font-mono": "IBM Plex Mono, Cascadia Mono, ui-monospace, monospace"
  },
  "light": {
    "color-base-100": "oklch(0.975 0.004 252)",
    "color-base-200": "oklch(0.947 0.007 252)",
    "color-base-300": "oklch(0.825 0.014 252)",
    "color-base-content": "oklch(0.215 0.023 252)",
    "color-base-raised": "oklch(1.000 0.003 252)",
    "color-primary": "oklch(0.520 0.154 252)",
    "color-primary-content": "oklch(1.000 0.003 252)",
    "color-secondary": "oklch(0.645 0.169 034)",
    "color-secondary-content": "oklch(0.170 0.020 252)",
    "color-accent": "oklch(0.490 0.065 280)",
    "color-accent-content": "oklch(1.000 0.003 252)",
    "color-neutral": "oklch(0.350 0.028 252)",
    "color-neutral-content": "oklch(0.975 0.004 252)",
    "color-info": "oklch(0.738 0.133 219)",
    "color-info-content": "oklch(0.170 0.020 252)",
    "color-success": "oklch(0.663 0.131 168)",
    "color-success-content": "oklch(0.170 0.020 252)",
    "color-warning": "oklch(0.785 0.154 061)",
    "color-warning-content": "oklch(0.170 0.020 252)",
    "color-danger": "oklch(0.545 0.188 024)",
    "color-danger-content": "oklch(1.000 0.003 252)"
  },
  "dark": {
    "color-base-100": "oklch(0.215 0.023 252)",
    "color-base-200": "oklch(0.170 0.020 252)",
    "color-base-300": "oklch(0.440 0.026 252)",
    "color-base-content": "oklch(0.975 0.004 252)",
    "color-base-raised": "oklch(0.275 0.026 252)",
    "color-primary": "oklch(0.690 0.141 252)",
    "color-primary-content": "oklch(0.170 0.020 252)",
    "color-secondary": "oklch(0.715 0.152 034)",
    "color-secondary-content": "oklch(0.170 0.020 252)",
    "color-accent": "oklch(0.680 0.055 280)",
    "color-accent-content": "oklch(0.170 0.020 252)",
    "color-neutral": "oklch(0.947 0.007 252)",
    "color-neutral-content": "oklch(0.170 0.020 252)",
    "color-info": "oklch(0.738 0.133 219)",
    "color-info-content": "oklch(0.170 0.020 252)",
    "color-success": "oklch(0.663 0.131 168)",
    "color-success-content": "oklch(0.170 0.020 252)",
    "color-warning": "oklch(0.785 0.154 061)",
    "color-warning-content": "oklch(0.170 0.020 252)",
    "color-danger": "oklch(0.545 0.188 024)",
    "color-danger-content": "oklch(1.000 0.003 252)"
  }
}
